{
  "schema_version": "avila.core/evidence-contract/v0.2-draft",
  "semantic_profile": "avila.core/semantic/0.2-draft",
  "contract_id": "fixture.types.R7.placeholder-draft.pass",
  "revision": 1,
  "status": "draft",
  "question": "Specimen question for types.R7.placeholder-draft.pass; it has no physical meaning.",
  "workflow": [
    {
      "step_id": "evaluate",
      "capability_type": {
        "id": "fixture.parameterized_metric",
        "major": 1
      },
      "parameters": {
        "cooling_time": "not_defined"
      }
    }
  ],
  "requirements": [
    {
      "requirement_id": "R-001",
      "statement": "Bounded shutdown dose rate remains below the limit.",
      "metric": {
        "source": "step_output",
        "step_id": "evaluate",
        "output_slot": "bounded_dose_rate"
      },
      "comparison": "less_than_or_equal",
      "limit": {
        "kind": "nuclear.dose_equivalent_rate",
        "value": "100",
        "unit": "uSv/h"
      },
      "basis": {
        "kind": "bounded"
      },
      "purpose": {
        "id": "fixture.requirement_evaluation",
        "major": 1
      }
    }
  ]
}
